{
  "iso3": "RWA",
  "profile_version": "2026.10.27.remediated",
  "executive_assessment": [
    {
      "text": "The new material differentiates Huye and Gisagara's reported vulnerability and adoption constraints from flood-exposed Volcanoes Region districts; these are selected examples, not a nationwide local ranking.",
      "evidence_ids": [
        "RWA-E-104",
        "RWA-E-105",
        "RWA-E-108"
      ],
      "pathway_ids": []
    },
    {
      "text": "Gicumbi's adaptation fund reports training and funding reach, while the completion review could not establish use or effectiveness of the weather-information system. Outputs and intentions are not demonstrated resilience gains.",
      "evidence_ids": [
        "RWA-E-109",
        "RWA-E-110"
      ],
      "pathway_ids": []
    }
  ],
  "coverage": [
    {
      "dimension": "evidence-class",
      "value": "climate-pressure",
      "status": "partial",
      "record_ids": [
        "RWA-E-001",
        "RWA-E-002",
        "RWA-E-004"
      ],
      "gap_note": "Selected source-supported evidence only; not comprehensive."
    },
    {
      "dimension": "evidence-class",
      "value": "exposure",
      "status": "partial",
      "record_ids": [
        "RWA-E-003",
        "RWA-E-005",
        "RWA-E-006",
        "RWA-E-112"
      ],
      "gap_note": "Selected source-supported evidence only; not comprehensive."
    },
    {
      "dimension": "evidence-class",
      "value": "sensitivity",
      "status": "partial",
      "record_ids": [
        "RWA-E-007",
        "RWA-E-101",
        "RWA-E-102",
        "RWA-E-104",
        "RWA-E-108"
      ],
      "gap_note": "Selected source-supported evidence only; not comprehensive."
    },
    {
      "dimension": "evidence-class",
      "value": "coping-capacity",
      "status": "partial",
      "record_ids": [
        "RWA-E-103"
      ],
      "gap_note": "Selected source-supported evidence only; not comprehensive."
    },
    {
      "dimension": "evidence-class",
      "value": "adaptive-capacity",
      "status": "partial",
      "record_ids": [
        "RWA-E-105",
        "RWA-E-107"
      ],
      "gap_note": "Selected source-supported evidence only; not comprehensive."
    },
    {
      "dimension": "evidence-class",
      "value": "institutional-capacity",
      "status": "partial",
      "record_ids": [
        "RWA-E-106",
        "RWA-E-113"
      ],
      "gap_note": "Selected source-supported evidence only; not comprehensive."
    },
    {
      "dimension": "evidence-class",
      "value": "response-performance",
      "status": "partial",
      "record_ids": [
        "RWA-E-109",
        "RWA-E-110"
      ],
      "gap_note": "Selected source-supported evidence only; not comprehensive."
    },
    {
      "dimension": "evidence-class",
      "value": "direct-climate-fcv",
      "status": "gap",
      "record_ids": [],
      "gap_note": "No dedicated record assembled; absence of evidence is not absence of risk."
    },
    {
      "dimension": "evidence-class",
      "value": "resilience-peace-capacity",
      "status": "gap",
      "record_ids": [],
      "gap_note": "No dedicated record assembled; absence of evidence is not absence of risk."
    },
    {
      "dimension": "geography",
      "value": "new named subnational examples",
      "status": "partial",
      "record_ids": [
        "RWA-E-104",
        "RWA-E-105",
        "RWA-E-106",
        "RWA-E-107",
        "RWA-E-108",
        "RWA-E-109",
        "RWA-E-112"
      ],
      "gap_note": "Named places only; generic rural/coastal zones excluded. No complete local risk ranking."
    },
    {
      "dimension": "pathway",
      "value": "mediated climate-FCV links",
      "status": "gap",
      "record_ids": [],
      "gap_note": "No complete supported chain assembled; do not infer one from co-occurrence."
    }
  ],
  "geographic_notes": [
    {
      "text": "Tearfund reports that Huye's vulnerability index declined to 0.556 over the previous five years as adaptive capacity strengthened, while Gisagara's index rose to 0.626.",
      "evidence_ids": [
        "RWA-E-104"
      ],
      "pathway_ids": []
    },
    {
      "text": "Smallholder farmers were willing to adopt agroforestry and terracing, but limited training, quality inputs, and finance impeded uptake.",
      "evidence_ids": [
        "RWA-E-105"
      ],
      "pathway_ids": []
    },
    {
      "text": "The review found national climate strategies relevant to local communities and associated with positive changes, but identified coordination and targeted-support gaps affecting the most vulnerable communities.",
      "evidence_ids": [
        "RWA-E-106"
      ],
      "pathway_ids": []
    },
    {
      "text": "Tearfund described capacity-building for locally led restoration, especially with women, to strengthen community participation in environmental decisions and local monitoring and management skills.",
      "evidence_ids": [
        "RWA-E-107"
      ],
      "pathway_ids": []
    },
    {
      "text": "The completion report identifies Burera, Nyabihu, Rubavu and Musanze in the Volcanoes Region as highly climate-vulnerable; it associates major floods with landslides, erosion, crop losses and infrastructure damage.",
      "evidence_ids": [
        "RWA-E-108"
      ],
      "pathway_ids": []
    },
    {
      "text": "The 2022-2023 Gicumbi Community Adaptation Fund pilot supported 2,324 people, including 47.7 percent women, in 25 cooperatives with training and funding; 192 more people in 64 cooperatives received business-planning training.",
      "evidence_ids": [
        "RWA-E-109"
      ],
      "pathway_ids": []
    },
    {
      "text": "The framework cites 74 percent of district roads as landslide-exposed and lists flood- and landslide-damaged road and bridge sites in 20 districts across all four provinces after the May 2023 rains.",
      "evidence_ids": [
        "RWA-E-112"
      ],
      "pathway_ids": []
    }
  ],
  "sector_notes": [],
  "known_gaps": [
    {
      "text": "Automated machine-screening is not independent source verification. Routine/default app-use approval does not certify claims or sources. 18 of 19 evidence records and 0 of 0 pathways lack claim-level verification in this remediation; review the linked records before relying on them.",
      "evidence_ids": [
        "RWA-E-001",
        "RWA-E-002",
        "RWA-E-003",
        "RWA-E-004",
        "RWA-E-005",
        "RWA-E-006",
        "RWA-E-007",
        "RWA-E-101",
        "RWA-E-102",
        "RWA-E-103",
        "RWA-E-105",
        "RWA-E-106",
        "RWA-E-107",
        "RWA-E-108",
        "RWA-E-109",
        "RWA-E-110",
        "RWA-E-112",
        "RWA-E-113"
      ],
      "pathway_ids": []
    },
    {
      "text": "Opened sources report climate-related disaster losses and mobility but do not establish a country-specific climate-to-violence causal pathway.",
      "evidence_ids": [],
      "pathway_ids": []
    },
    {
      "text": "Draft collection pending human source review and approval. IDA eligibility is not an FCV classification.",
      "evidence_ids": [],
      "pathway_ids": []
    },
    {
      "text": "National and selected local examples do not establish district-level coverage or causal attribution.",
      "evidence_ids": [],
      "pathway_ids": []
    },
    {
      "text": "The bank contains no completed mediated climate-FCV pathway; this is an evidence gap, not evidence of absence.",
      "evidence_ids": [],
      "pathway_ids": []
    },
    {
      "text": "No Rwanda-specific source found in the targeted search established an observed climate-to-FCV pathway; the only explicit country-specific link identified was a broad potential-risk sentence in a draft project ESMF.",
      "evidence_ids": [],
      "pathway_ids": []
    },
    {
      "text": "The reverse-FCV search did not locate evidence that conflict, insecurity, or displacement has constrained Rwanda's climate adaptation or resilience delivery.",
      "evidence_ids": [],
      "pathway_ids": []
    },
    {
      "text": "The UCLouvain full-text PDF and Tearfund full report could not be retrieved; their claims rely on accessible publisher abstracts and summaries.",
      "evidence_ids": [],
      "pathway_ids": []
    },
    {
      "text": "The UCLouvain abstract does not identify the individual higher-risk cells, limiting finer subnational mapping.",
      "evidence_ids": [],
      "pathway_ids": []
    },
    {
      "text": "Most resilience evidence covers plans, project outputs, or a pilot rather than independently measured reductions in climate vulnerability.",
      "evidence_ids": [],
      "pathway_ids": []
    },
    {
      "text": "No new documented conflict mechanism was imported. The ESMF's generic border-conflict warning is retained only in the research audit, not operational evidence.",
      "evidence_ids": [],
      "pathway_ids": []
    },
    {
      "text": "New district examples deepen selected local vulnerabilities and project outputs, not a complete national district risk ranking.",
      "evidence_ids": [],
      "pathway_ids": []
    },
    {
      "text": "Routine/default app-use approval granted by Lindsey Jones on 2026-10-27; independent source verification remains incomplete. Lending eligibility is not an FCV classification.",
      "evidence_ids": [],
      "pathway_ids": []
    }
  ],
  "selection_aliases": {
    "geographies": {},
    "sectors": {},
    "affected_groups": {},
    "institutions": {},
    "systems_assets": {},
    "hazards": {}
  },
  "review_status": "approved",
  "review_date": "2026-10-27"
}
