{
  "iso3": "KEN",
  "profile_version": "2026.10.26.deep",
  "executive_assessment": [
    {
      "text": "Turkana evidence differentiates livelihood and gender vulnerabilities and identifies resource/coordination barriers. It is dated May 2023, not a current county risk ranking.",
      "evidence_ids": [
        "KEN-E-101",
        "KEN-E-102",
        "KEN-E-103",
        "KEN-E-104"
      ],
      "pathway_ids": [
        "KEN-P-101"
      ]
    },
    {
      "text": "Sarima shows historical energy-project benefit and water-service tensions; Samburu and pastoral-service networks add governance capacities, with no independent outcome evaluation.",
      "evidence_ids": [
        "KEN-E-109",
        "KEN-E-112",
        "KEN-E-113"
      ],
      "pathway_ids": []
    }
  ],
  "coverage": [
    {
      "dimension": "evidence-class",
      "value": "climate-pressure",
      "status": "partial",
      "record_ids": [
        "KEN-E-006"
      ],
      "gap_note": "Selected source-supported evidence only; not comprehensive."
    },
    {
      "dimension": "evidence-class",
      "value": "exposure",
      "status": "partial",
      "record_ids": [
        "KEN-E-001",
        "KEN-E-004"
      ],
      "gap_note": "Selected source-supported evidence only; not comprehensive."
    },
    {
      "dimension": "evidence-class",
      "value": "sensitivity",
      "status": "partial",
      "record_ids": [
        "KEN-E-005",
        "KEN-E-101",
        "KEN-E-103",
        "KEN-E-109",
        "KEN-E-110"
      ],
      "gap_note": "Selected source-supported evidence only; not comprehensive."
    },
    {
      "dimension": "evidence-class",
      "value": "coping-capacity",
      "status": "gap",
      "record_ids": [],
      "gap_note": "No dedicated record assembled; absence of evidence is not absence of risk."
    },
    {
      "dimension": "evidence-class",
      "value": "adaptive-capacity",
      "status": "gap",
      "record_ids": [],
      "gap_note": "No dedicated record assembled; absence of evidence is not absence of risk."
    },
    {
      "dimension": "evidence-class",
      "value": "institutional-capacity",
      "status": "partial",
      "record_ids": [
        "KEN-E-104"
      ],
      "gap_note": "Selected source-supported evidence only; not comprehensive."
    },
    {
      "dimension": "evidence-class",
      "value": "response-performance",
      "status": "partial",
      "record_ids": [
        "KEN-E-003"
      ],
      "gap_note": "Selected source-supported evidence only; not comprehensive."
    },
    {
      "dimension": "evidence-class",
      "value": "direct-climate-fcv",
      "status": "partial",
      "record_ids": [
        "KEN-E-002",
        "KEN-E-102",
        "KEN-E-105",
        "KEN-E-107"
      ],
      "gap_note": "Selected source-supported evidence only; not comprehensive."
    },
    {
      "dimension": "evidence-class",
      "value": "resilience-peace-capacity",
      "status": "partial",
      "record_ids": [
        "KEN-E-106",
        "KEN-E-112",
        "KEN-E-113"
      ],
      "gap_note": "Selected source-supported evidence only; not comprehensive."
    },
    {
      "dimension": "geography",
      "value": "new named subnational examples",
      "status": "partial",
      "record_ids": [
        "KEN-E-101",
        "KEN-E-102",
        "KEN-E-103",
        "KEN-E-104",
        "KEN-E-105",
        "KEN-E-106",
        "KEN-E-107",
        "KEN-E-109",
        "KEN-E-110",
        "KEN-E-112",
        "KEN-E-113"
      ],
      "gap_note": "Named places only; generic rural/coastal zones excluded. No complete local risk ranking."
    },
    {
      "dimension": "pathway",
      "value": "mediated climate-FCV links",
      "status": "partial",
      "record_ids": [
        "KEN-P-001",
        "KEN-P-101"
      ],
      "gap_note": "Conditional mechanisms, not national causal estimates."
    }
  ],
  "geographic_notes": [
    {
      "text": "Turkana's May 2023 county assessment describes drought, floods, intense rainfall and unreliable seasons affecting pastoral, farming, fishing and water-dependent livelihoods.",
      "evidence_ids": [
        "KEN-E-101"
      ],
      "pathway_ids": []
    },
    {
      "text": "Turkana's May 2023 county assessment describes drought and heat reducing pasture and water and increasing grazing competition and the likelihood of insecurity.",
      "evidence_ids": [
        "KEN-E-102"
      ],
      "pathway_ids": []
    },
    {
      "text": "The May 2023 Turkana assessment describes women and girls traveling far for riverbed water and higher drought-related malnutrition risks for pregnant/lactating women, children and older people.",
      "evidence_ids": [
        "KEN-E-103"
      ],
      "pathway_ids": []
    },
    {
      "text": "The May 2023 Turkana assessment identifies inadequate resources and poor institutional coordination as adaptation barriers; it describes community action groups as a resource-management capacity, without evaluating outcomes.",
      "evidence_ids": [
        "KEN-E-104"
      ],
      "pathway_ids": []
    },
    {
      "text": "International Alert's February 2026 publisher summary describes drought, floods and resource pressures amplifying competition among pastoral, agropastoral and fishing communities in Marsabit and Turkana.",
      "evidence_ids": [
        "KEN-E-105"
      ],
      "pathway_ids": []
    },
    {
      "text": "International Alert's February 2026 summary describes unequal land/water access, movement and conservation restrictions as livelihood and tension mediators, and recommends inclusive conflict-sensitive programming.",
      "evidence_ids": [
        "KEN-E-106"
      ],
      "pathway_ids": []
    },
    {
      "text": "A 2023 structured review describes drought-related pasture and water stress alongside resource-related raids in Turkana, Samburu and Marsabit, while emphasizing contested and varying mechanisms.",
      "evidence_ids": [
        "KEN-E-107"
      ],
      "pathway_ids": []
    },
    {
      "text": "The 2023 review describes historical wind-park job disputes between Turkana and Samburu in Sarima and a failed borehole desalination unit; these illustrate project-benefit and service risks, not proof that climate hazards caused violence.",
      "evidence_ids": [
        "KEN-E-109"
      ],
      "pathway_ids": []
    },
    {
      "text": "At publication in 2023, the review described oil-site roadblocks and attacks over water and employment, alongside prospective production risks; this is not an update on 2026 oil operations.",
      "evidence_ids": [
        "KEN-E-110"
      ],
      "pathway_ids": []
    },
    {
      "text": "Saferworld reports supporting a Samburu rangeland-access legislative process during 2018-2022, alongside a peace/cohesion forum; institutional outputs do not establish reduced conflict.",
      "evidence_ids": [
        "KEN-E-112"
      ],
      "pathway_ids": []
    },
    {
      "text": "ACIAR's July 2023 publisher summary recommends recognizing local pastoral-service networks in Isiolo and Marsabit, including herders, herd owners, animal-health providers, mobile-money services and brokers.",
      "evidence_ids": [
        "KEN-E-113"
      ],
      "pathway_ids": []
    }
  ],
  "sector_notes": [],
  "known_gaps": [
    {
      "text": "The World Bank CCDR PDF could not be opened in this collection workflow; no CCDR-based claims are included.",
      "evidence_ids": [],
      "pathway_ids": []
    },
    {
      "text": "Draft collection pending human source review and approval. IDA eligibility is not an FCV classification.",
      "evidence_ids": [],
      "pathway_ids": []
    },
    {
      "text": "National and selected local examples do not establish district-level coverage or causal attribution.",
      "evidence_ids": [],
      "pathway_ids": []
    },
    {
      "text": "Government-described resource-conflict mechanism has no event-specific causal estimate.",
      "evidence_ids": [],
      "pathway_ids": []
    },
    {
      "text": "The most detailed subnational hazard and gender evidence located is Turkana's 2023 county assessment; no newer comparable county assessment was added for Marsabit or Samburu.",
      "evidence_ids": [],
      "pathway_ids": []
    },
    {
      "text": "International Alert and ACIAR full reports were not inspected, so related claims remain limited to publisher summaries.",
      "evidence_ids": [],
      "pathway_ids": []
    },
    {
      "text": "Conflict-related constraints on adaptation are mostly synthesized from literature or program descriptions; independent current evaluation evidence remains limited.",
      "evidence_ids": [],
      "pathway_ids": []
    },
    {
      "text": "No present-day county conflict prevalence is inferred from the 2023 Turkana assessment or historical energy-project cases.",
      "evidence_ids": [],
      "pathway_ids": []
    },
    {
      "text": "The strongest new direct mechanism is locally reported resource competition; implementer descriptions and recommendations are not independent outcome evidence.",
      "evidence_ids": [],
      "pathway_ids": []
    },
    {
      "text": "Draft extension: human source review and approval remain pending. Lending eligibility is not an FCV classification.",
      "evidence_ids": [],
      "pathway_ids": []
    }
  ],
  "selection_aliases": {
    "geographies": {},
    "sectors": {},
    "affected_groups": {},
    "institutions": {},
    "systems_assets": {},
    "hazards": {}
  },
  "review_status": "draft",
  "review_date": null
}
