{
  "iso3": "SLV",
  "profile_version": "2026.10.27.remediated",
  "executive_assessment": [
    {
      "text": "Historical assessments identify Dry Corridor agricultural dependence and named high-vulnerability departments, alongside metropolitan flood and landslide exposure.",
      "evidence_ids": [
        "SLV-E-102",
        "SLV-E-103",
        "SLV-E-105",
        "SLV-E-112",
        "SLV-E-113",
        "SLV-E-114"
      ],
      "pathway_ids": []
    },
    {
      "text": "The 2019 SIPRI/WFP research describes drought, weak cohesion and gang restrictions on programme participation; these are local historical mechanisms, not a current national climate–violence estimate.",
      "evidence_ids": [
        "SLV-E-109",
        "SLV-E-110",
        "SLV-E-111"
      ],
      "pathway_ids": [
        "SLV-P-101"
      ]
    }
  ],
  "coverage": [
    {
      "dimension": "evidence-class",
      "value": "climate-pressure",
      "status": "gap",
      "record_ids": [],
      "gap_note": "No dedicated record assembled; absence of evidence is not absence of risk."
    },
    {
      "dimension": "evidence-class",
      "value": "exposure",
      "status": "partial",
      "record_ids": [
        "SLV-E-103",
        "SLV-E-112"
      ],
      "gap_note": "Selected source-supported evidence only; not comprehensive."
    },
    {
      "dimension": "evidence-class",
      "value": "sensitivity",
      "status": "partial",
      "record_ids": [
        "SLV-E-102",
        "SLV-E-105",
        "SLV-E-113"
      ],
      "gap_note": "Selected source-supported evidence only; not comprehensive."
    },
    {
      "dimension": "evidence-class",
      "value": "coping-capacity",
      "status": "partial",
      "record_ids": [
        "SLV-E-110",
        "SLV-E-114"
      ],
      "gap_note": "Selected source-supported evidence only; not comprehensive."
    },
    {
      "dimension": "evidence-class",
      "value": "adaptive-capacity",
      "status": "gap",
      "record_ids": [],
      "gap_note": "No dedicated record assembled; absence of evidence is not absence of risk."
    },
    {
      "dimension": "evidence-class",
      "value": "institutional-capacity",
      "status": "partial",
      "record_ids": [
        "SLV-E-107",
        "SLV-E-108"
      ],
      "gap_note": "Selected source-supported evidence only; not comprehensive."
    },
    {
      "dimension": "evidence-class",
      "value": "response-performance",
      "status": "gap",
      "record_ids": [],
      "gap_note": "No dedicated record assembled; absence of evidence is not absence of risk."
    },
    {
      "dimension": "evidence-class",
      "value": "direct-climate-fcv",
      "status": "partial",
      "record_ids": [
        "SLV-E-101",
        "SLV-E-109"
      ],
      "gap_note": "Selected source-supported evidence only; not comprehensive."
    },
    {
      "dimension": "evidence-class",
      "value": "resilience-peace-capacity",
      "status": "partial",
      "record_ids": [
        "SLV-E-111"
      ],
      "gap_note": "Selected source-supported evidence only; not comprehensive."
    },
    {
      "dimension": "geography",
      "value": "new named subnational examples",
      "status": "partial",
      "record_ids": [
        "SLV-E-103",
        "SLV-E-105",
        "SLV-E-110",
        "SLV-E-112",
        "SLV-E-113"
      ],
      "gap_note": "Named places only; generic rural/coastal zones excluded. No complete local risk ranking."
    },
    {
      "dimension": "pathway",
      "value": "mediated climate-FCV links",
      "status": "partial",
      "record_ids": [
        "SLV-P-101"
      ],
      "gap_note": "Conditional mechanisms, not national causal estimates."
    }
  ],
  "geographic_notes": [
    {
      "text": "Source dated 2024 reports: The assessment places 73% of districts in high-drought zones, concentrated in high-poverty Usulután, Ahuachapán, Cabañas and La Unión departments.",
      "evidence_ids": [
        "SLV-E-103"
      ],
      "pathway_ids": []
    },
    {
      "text": "Source dated 2025 reports: The 2025 NDC says 88.7% of national territory faces disaster risk; Cabañas, Morazán and Ahuachapán have high vulnerability combining socioeconomic factors, weak basic-service access and environmental stress.",
      "evidence_ids": [
        "SLV-E-105"
      ],
      "pathway_ids": []
    },
    {
      "text": "Source dated 2019-11 reports: The study reports that gang dynamics required WFP to negotiate program access and beneficiaries to obtain permission to participate; field visits included San Miguel, Uluazapa, Jiquilisco, Ozatlán, Usulután, Suchitoto, Agua Caliente and San Salvador.",
      "evidence_ids": [
        "SLV-E-110"
      ],
      "pathway_ids": []
    },
    {
      "text": "Source dated 2018-02 reports: The assessment ranks San Salvador, Soyapango, Ilopango and Cuscatancingo as most vulnerable to heavy-rain flooding and landslides; San Salvador recorded 209 floods and 79 landslides during 1960–2015.",
      "evidence_ids": [
        "SLV-E-112"
      ],
      "pathway_ids": []
    },
    {
      "text": "Source dated 2018-02 reports: During three years of rainfall anomalies, maize and sorghum yields fell 43% and bean yields 29% in La Unión and Morazán; over 90% of producers used maize-bean-sorghum systems.",
      "evidence_ids": [
        "SLV-E-113"
      ],
      "pathway_ids": []
    }
  ],
  "sector_notes": [],
  "known_gaps": [
    {
      "text": "Automated machine-screening is not independent source verification. Routine/default app-use approval does not certify claims or sources. 11 of 12 evidence records and 1 of 1 pathways lack claim-level verification in this remediation; review the linked records before relying on them.",
      "evidence_ids": [
        "SLV-E-101",
        "SLV-E-102",
        "SLV-E-103",
        "SLV-E-105",
        "SLV-E-107",
        "SLV-E-108",
        "SLV-E-110",
        "SLV-E-111",
        "SLV-E-112",
        "SLV-E-113",
        "SLV-E-114"
      ],
      "pathway_ids": [
        "SLV-P-101"
      ]
    },
    {
      "text": "The sources do not establish a climate cause of gang violence; the 2024 World Bank statement is explicitly conditional, while the SIPRI/WFP nexus description is a qualitative 2019 context analysis.",
      "evidence_ids": [],
      "pathway_ids": []
    },
    {
      "text": "No current subnational assessment was found showing how insecurity constrains climate-adaptation implementation in 2026; SIPRI/WFP program-access observations date to 2019.",
      "evidence_ids": [],
      "pathway_ids": []
    },
    {
      "text": "The 2023 Climate-Fragility Risk Brief PDF exceeded direct retrieval limits and was not used; the WFP Central American Dry Corridor report PDF returned 403 and only its landing page was opened.",
      "evidence_ids": [],
      "pathway_ids": []
    },
    {
      "text": "March 2019 gang and programme-access findings are historical; they do not describe the materially different 2026 security context.",
      "evidence_ids": [],
      "pathway_ids": []
    },
    {
      "text": "Field-visit municipalities are not assigned identical gang restrictions. No source establishes that drought caused gang formation or measures a climate-attributable violence rate.",
      "evidence_ids": [],
      "pathway_ids": []
    },
    {
      "text": "Routine/default app-use approval granted by Lindsey Jones on 2026-10-27; independent source verification remains incomplete. Lending eligibility is not an FCV classification.",
      "evidence_ids": [],
      "pathway_ids": []
    }
  ],
  "selection_aliases": {
    "geographies": {},
    "sectors": {},
    "affected_groups": {},
    "institutions": {},
    "systems_assets": {},
    "hazards": {}
  },
  "review_status": "approved",
  "review_date": "2026-10-27"
}
