{
  "iso3": "ROU",
  "profile_version": "2026.10.27.remediated",
  "executive_assessment": [
    {
      "text": "Evidence distinguishes Danube/Siret flood exposure, coastal planning weaknesses in Constanța County and southern/southeastern agricultural drought sensitivity.",
      "evidence_ids": [
        "ROU-E-102",
        "ROU-E-104",
        "ROU-E-106"
      ],
      "pathway_ids": []
    },
    {
      "text": "Historical flood-plan delivery and coordination gaps, and lower indexed adaptive capacity in eastern regions, identify institutional constraints rather than violent conflict.",
      "evidence_ids": [
        "ROU-E-105",
        "ROU-E-108",
        "ROU-E-112",
        "ROU-E-113"
      ],
      "pathway_ids": []
    },
    {
      "text": "The UCPM profile's conflict-risk projection lacks a specified mediator and is not expanded into a pathway. Municipal and meadow-restoration initiatives remain reported capacities, not proven outcomes.",
      "evidence_ids": [
        "ROU-E-109",
        "ROU-E-111",
        "ROU-E-117",
        "ROU-E-118"
      ],
      "pathway_ids": []
    }
  ],
  "coverage": [
    {
      "dimension": "evidence-class",
      "value": "climate-pressure",
      "status": "partial",
      "record_ids": [
        "ROU-E-101"
      ],
      "gap_note": "Selected source-supported evidence only; not comprehensive."
    },
    {
      "dimension": "evidence-class",
      "value": "exposure",
      "status": "partial",
      "record_ids": [
        "ROU-E-102"
      ],
      "gap_note": "Selected source-supported evidence only; not comprehensive."
    },
    {
      "dimension": "evidence-class",
      "value": "sensitivity",
      "status": "partial",
      "record_ids": [
        "ROU-E-103",
        "ROU-E-104",
        "ROU-E-106",
        "ROU-E-114",
        "ROU-E-115"
      ],
      "gap_note": "Selected source-supported evidence only; not comprehensive."
    },
    {
      "dimension": "evidence-class",
      "value": "coping-capacity",
      "status": "partial",
      "record_ids": [
        "ROU-E-107"
      ],
      "gap_note": "Selected source-supported evidence only; not comprehensive."
    },
    {
      "dimension": "evidence-class",
      "value": "adaptive-capacity",
      "status": "partial",
      "record_ids": [
        "ROU-E-109",
        "ROU-E-110",
        "ROU-E-116",
        "ROU-E-117",
        "ROU-E-118"
      ],
      "gap_note": "Selected source-supported evidence only; not comprehensive."
    },
    {
      "dimension": "evidence-class",
      "value": "institutional-capacity",
      "status": "partial",
      "record_ids": [
        "ROU-E-105",
        "ROU-E-108",
        "ROU-E-112",
        "ROU-E-113"
      ],
      "gap_note": "Selected source-supported evidence only; not comprehensive."
    },
    {
      "dimension": "evidence-class",
      "value": "response-performance",
      "status": "gap",
      "record_ids": [],
      "gap_note": "No dedicated record assembled; absence of evidence is not absence of risk."
    },
    {
      "dimension": "evidence-class",
      "value": "direct-climate-fcv",
      "status": "partial",
      "record_ids": [
        "ROU-E-111"
      ],
      "gap_note": "Selected source-supported evidence only; not comprehensive."
    },
    {
      "dimension": "evidence-class",
      "value": "resilience-peace-capacity",
      "status": "gap",
      "record_ids": [],
      "gap_note": "No dedicated record assembled; absence of evidence is not absence of risk."
    },
    {
      "dimension": "geography",
      "value": "new named subnational examples",
      "status": "partial",
      "record_ids": [
        "ROU-E-102",
        "ROU-E-104",
        "ROU-E-109",
        "ROU-E-118"
      ],
      "gap_note": "Named places only; generic rural/coastal zones excluded. No complete local risk ranking."
    },
    {
      "dimension": "pathway",
      "value": "mediated climate-FCV links",
      "status": "gap",
      "record_ids": [],
      "gap_note": "No complete supported chain assembled; do not infer one from co-occurrence."
    }
  ],
  "geographic_notes": [
    {
      "text": "Source dated 2026-03-16 reports: In Romania's Danube Basin, about 25% of the population and 8% of territory are flood-exposed; Danube and Siret floods peak in spring and early summer.",
      "evidence_ids": [
        "ROU-E-102"
      ],
      "pathway_ids": []
    },
    {
      "text": "Source dated 2026-03-16 reports: OECD describes urban expansion in Constanța County coastal towns without sufficient elevation or drainage upgrades despite known pluvial and coastal flood risks.",
      "evidence_ids": [
        "ROU-E-104"
      ],
      "pathway_ids": []
    },
    {
      "text": "Source dated 2023-12-18 reports: Romania cited Alba Iulia's municipal plan as good practice and reported two regions joining the EU Adaptation Mission.",
      "evidence_ids": [
        "ROU-E-109"
      ],
      "pathway_ids": []
    },
    {
      "text": "The EU Adaptation Mission portal describes meadow-restoration projects covering 40 hectares in Râu Sadului and Cristian, using drones to address drought, biodiversity loss and erosion. The short project account does not establish completed restoration or measured resilience gains.",
      "evidence_ids": [
        "ROU-E-118"
      ],
      "pathway_ids": []
    }
  ],
  "sector_notes": [],
  "known_gaps": [
    {
      "text": "Automated machine-screening is not independent source verification or human approval. 18 of 18 evidence records and 0 of 0 pathways lack claim-level verification in this remediation; review the linked records before relying on them.",
      "evidence_ids": [
        "ROU-E-101",
        "ROU-E-102",
        "ROU-E-103",
        "ROU-E-104",
        "ROU-E-105",
        "ROU-E-106",
        "ROU-E-107",
        "ROU-E-108",
        "ROU-E-109",
        "ROU-E-110",
        "ROU-E-111",
        "ROU-E-112",
        "ROU-E-113",
        "ROU-E-114",
        "ROU-E-115",
        "ROU-E-116",
        "ROU-E-117",
        "ROU-E-118"
      ],
      "pathway_ids": []
    },
    {
      "text": "No directly read primary source established an FCV-to-climate-adaptation mechanism for Romania; search results on displacement were leads only.",
      "evidence_ids": [],
      "pathway_ids": []
    },
    {
      "text": "The UCPM profile's climate-scenario statement that conflict risk may rise provides no conflict mechanism, model details or uncertainty bounds; it is retained only as that source-stated projection.",
      "evidence_ids": [],
      "pathway_ids": []
    },
    {
      "text": "The linked full Romania CCDR and the 2026 European Commission country-report PDF could not be directly accessed; their indexed text was excluded.",
      "evidence_ids": [],
      "pathway_ids": []
    },
    {
      "text": "The ICPDR Danube Delta publisher page returned 403; its indexed summary was excluded from evidence.",
      "evidence_ids": [],
      "pathway_ids": []
    },
    {
      "text": "No complete climate-FCV pathway is assembled from an opaque national conflict-risk projection.",
      "evidence_ids": [],
      "pathway_ids": []
    },
    {
      "text": "Flood exposure and adaptive-capacity indices are not local harm counts or a fragility classification.",
      "evidence_ids": [],
      "pathway_ids": []
    },
    {
      "text": "Draft extension: human source review and approval remain pending. Lending eligibility is not an FCV classification.",
      "evidence_ids": [],
      "pathway_ids": []
    }
  ],
  "selection_aliases": {
    "geographies": {},
    "sectors": {},
    "affected_groups": {},
    "institutions": {},
    "systems_assets": {},
    "hazards": {}
  },
  "review_status": "draft",
  "review_date": null
}
