{
  "iso3": "IND",
  "profile_version": "2026.10.27.remediated",
  "executive_assessment": [
    {
      "text": "Comparative district flood/drought and heat indices identify named differences; outdoor workers, people with limited shelter and other vulnerable groups face different coping constraints.",
      "evidence_ids": [
        "IND-E-101",
        "IND-E-102",
        "IND-E-103",
        "IND-E-104",
        "IND-E-105",
        "IND-E-106",
        "IND-E-109"
      ],
      "pathway_ids": []
    },
    {
      "text": "A national study finds drought–IPV associations, with different samples for precipitation and socioeconomic drought, but cannot establish causality or income mediation. Heat-plan counts describe planning coverage, not effectiveness.",
      "evidence_ids": [
        "IND-E-107",
        "IND-E-108",
        "IND-E-110"
      ],
      "pathway_ids": []
    }
  ],
  "coverage": [
    {
      "dimension": "evidence-class",
      "value": "climate-pressure",
      "status": "partial",
      "record_ids": [
        "IND-E-105",
        "IND-E-108"
      ],
      "gap_note": "Selected source-supported evidence only; not comprehensive."
    },
    {
      "dimension": "evidence-class",
      "value": "exposure",
      "status": "gap",
      "record_ids": [],
      "gap_note": "No dedicated record assembled; absence of evidence is not absence of risk."
    },
    {
      "dimension": "evidence-class",
      "value": "sensitivity",
      "status": "partial",
      "record_ids": [
        "IND-E-101",
        "IND-E-102",
        "IND-E-103",
        "IND-E-104",
        "IND-E-106",
        "IND-E-109"
      ],
      "gap_note": "Selected source-supported evidence only; not comprehensive."
    },
    {
      "dimension": "evidence-class",
      "value": "coping-capacity",
      "status": "gap",
      "record_ids": [],
      "gap_note": "No dedicated record assembled; absence of evidence is not absence of risk."
    },
    {
      "dimension": "evidence-class",
      "value": "adaptive-capacity",
      "status": "gap",
      "record_ids": [],
      "gap_note": "No dedicated record assembled; absence of evidence is not absence of risk."
    },
    {
      "dimension": "evidence-class",
      "value": "institutional-capacity",
      "status": "gap",
      "record_ids": [],
      "gap_note": "No dedicated record assembled; absence of evidence is not absence of risk."
    },
    {
      "dimension": "evidence-class",
      "value": "response-performance",
      "status": "partial",
      "record_ids": [
        "IND-E-107"
      ],
      "gap_note": "Selected source-supported evidence only; not comprehensive."
    },
    {
      "dimension": "evidence-class",
      "value": "direct-climate-fcv",
      "status": "partial",
      "record_ids": [
        "IND-E-110"
      ],
      "gap_note": "Selected source-supported evidence only; not comprehensive."
    },
    {
      "dimension": "evidence-class",
      "value": "resilience-peace-capacity",
      "status": "gap",
      "record_ids": [],
      "gap_note": "No dedicated record assembled; absence of evidence is not absence of risk."
    },
    {
      "dimension": "geography",
      "value": "new named subnational examples",
      "status": "partial",
      "record_ids": [
        "IND-E-101",
        "IND-E-102",
        "IND-E-103",
        "IND-E-104",
        "IND-E-105",
        "IND-E-106",
        "IND-E-108",
        "IND-E-109"
      ],
      "gap_note": "Named places only; generic rural/coastal zones excluded. No complete local risk ranking."
    },
    {
      "dimension": "pathway",
      "value": "mediated climate-FCV links",
      "status": "gap",
      "record_ids": [],
      "gap_note": "No complete supported chain assembled; do not infer one from co-occurrence."
    }
  ],
  "geographic_notes": [
    {
      "text": "Source dated 2024-12-17 reports: The district assessment placed 51 districts in very high and 118 in high flood-risk bands; about 85% of those districts are in Assam, Bihar, Uttar Pradesh, West Bengal, Gujarat, Odisha and Jammu and Kashmir.",
      "evidence_ids": [
        "IND-E-101"
      ],
      "pathway_ids": []
    },
    {
      "text": "Source dated 2024-12-17 reports: The assessment placed 91 districts in very high and 188 in high drought-risk bands; more than 85% of these districts are in Bihar, Assam, Jharkhand, Odisha, Uttar Pradesh, Maharashtra, West Bengal, Karnataka, Tamil Nadu, Chhattisgarh, Kerala, Uttarakhand and Haryana.",
      "evidence_ids": [
        "IND-E-102"
      ],
      "pathway_ids": []
    },
    {
      "text": "Source dated 2024-12-17 reports: Among the 50 districts with highest flood risk and 50 with highest drought risk, 11 were very high risk for both, including Patna, Alappuzha, Charaideo, Dibrugarh, Sibsagar, South Salmara-Mankachar, Golaghat, Kendrapara, Murshidabad, Nadia and Uttar Dinajpur.",
      "evidence_ids": [
        "IND-E-103"
      ],
      "pathway_ids": []
    },
    {
      "text": "Source dated 2025-05-20 reports: CEEW classed 417 of 734 districts (57%), home to 76% of residents, at high or very high heat risk; Delhi, Maharashtra, Goa, Kerala and Gujarat ranked among the highest-risk states.",
      "evidence_ids": [
        "IND-E-104"
      ],
      "pathway_ids": []
    },
    {
      "text": "Source dated 2025-05-20 reports: Comparing 2012–2022 with 1982–2011, CEEW found extra warm nights per summer in Mumbai (15), Bengaluru (11), Bhopal and Jaipur (7 each), Delhi (6) and Chennai (4); warm nights rose faster than hot days.",
      "evidence_ids": [
        "IND-E-105"
      ],
      "pathway_ids": []
    },
    {
      "text": "Source dated 2025-05-20 reports: CEEW found high heat vulnerability in districts of seven named states, where heat combined with chronic illness, older people and under-fives; Odisha districts with green cover and blue infrastructure had lower vulnerability.",
      "evidence_ids": [
        "IND-E-106"
      ],
      "pathway_ids": []
    },
    {
      "text": "Source dated 2026-07-20 reports: Delhi's SAPCC 2.0 assessment identifies South Delhi as most and New Delhi as least climate-vulnerable; it projects higher summer maximum temperatures and more very hot days by mid-century, with cool roofs, cooling corridors, green infrastructure, drainage and wetland measures envisaged.",
      "evidence_ids": [
        "IND-E-108"
      ],
      "pathway_ids": []
    },
    {
      "text": "Source dated 2025-05-01 reports: NHRC cited 3,798 NCRB-recorded heat and sun-stroke deaths in 2018–2022 and identified economically weaker people, outdoor workers, older people, children and homeless people as at risk from inadequate shelter and resources; it urged 11 states to provide protections.",
      "evidence_ids": [
        "IND-E-109"
      ],
      "pathway_ids": []
    }
  ],
  "sector_notes": [],
  "known_gaps": [
    {
      "text": "Automated machine-screening is not independent source verification or human approval. 10 of 10 evidence records and 0 of 0 pathways lack claim-level verification in this remediation; review the linked records before relying on them.",
      "evidence_ids": [
        "IND-E-101",
        "IND-E-102",
        "IND-E-103",
        "IND-E-104",
        "IND-E-105",
        "IND-E-106",
        "IND-E-107",
        "IND-E-108",
        "IND-E-109",
        "IND-E-110"
      ],
      "pathway_ids": []
    },
    {
      "text": "A peer-reviewed national study provides explicit drought–intimate-partner-violence associations but cannot establish causality or test the proposed household-income pathway; this is not evidence of an armed-conflict pathway.",
      "evidence_ids": [],
      "pathway_ids": []
    },
    {
      "text": "The reviewed material does not directly establish that conflict or insecurity changes climate exposure or blocks adaptation access.",
      "evidence_ids": [],
      "pathway_ids": []
    },
    {
      "text": "District heat classifications use 1982–2022 hazard data with older Census and NFHS indicators; they should not be read as a refreshed 2026 risk inventory.",
      "evidence_ids": [],
      "pathway_ids": []
    },
    {
      "text": "No complete causal income-mediated drought→IPV chain is assembled: the study explicitly could not test the proposed mediator. The two drought definitions have different analytical samples.",
      "evidence_ids": [],
      "pathway_ids": []
    },
    {
      "text": "District hazard/risk examples are not assigned the national study's violence associations as local effect estimates. No armed-conflict pathway or reverse insecurity constraint was verified.",
      "evidence_ids": [],
      "pathway_ids": []
    },
    {
      "text": "Draft extension: human source review and approval remain pending. Lending eligibility is not an FCV classification.",
      "evidence_ids": [],
      "pathway_ids": []
    }
  ],
  "selection_aliases": {
    "geographies": {},
    "sectors": {},
    "affected_groups": {},
    "institutions": {},
    "systems_assets": {},
    "hazards": {}
  },
  "review_status": "draft",
  "review_date": null
}
